{
  "schemaVersion": 1,
  "projectName": "Accessible 3D Puzzle Museum",
  "renderPath": "threejs-webgl2",
  "timingModel": "event",
  "existingFramework": null,
  "status": "not-built",
  "targetBrowsers": ["current Chromium", "current Firefox", "current Safari"],
  "capabilities": {
    "generatedAssets": false,
    "assetManifest": null,
    "assetAuthority": "none",
    "gltf": false,
    "webAudio": false,
    "gamepad": false,
    "workers": false,
    "sharedArrayBuffer": false,
    "deploymentAutomation": false,
    "postprocessing": false,
    "inverseKinematics": false,
    "spatialBroadphase": false,
    "instancing": false,
    "webgpu": false,
    "canvasDynamicTextures": false,
    "semanticDom": true,
    "reducedMotion": true,
    "physics": "off",
    "persistence": "localStorage"
  },
  "paths": {
    "frontend": ["src/demos/06-puzzle-museum"],
    "ignore": ["node_modules", "dist", "build", ".git", "coverage"],
    "allowedAssetLiteralFiles": []
  },
  "validation": {
    "commands": ["npm run typecheck", "npm test", "npm run build"],
    "browserUrl": "http://127.0.0.1:5173/#/demo/06-puzzle-museum",
    "readyExpression": "() => Boolean(window.__DEMO_STATUS__ && window.__DEMO_STATUS__.state === 'ready')"
  },
  "lint": { "ignoreCodes": [], "ignorePaths": [] }
}
